{
  "matchId": "33333333-3333-4333-8333-333333333333",
  "tableId": "44444444-4444-4444-8444-444444444444",
  "matchStatus": "MATCH_PAUSED",
  "roundState": "ROUND_GUESSING",
  "players": [
    {
      "userId": "11111111-1111-4111-8111-111111111111",
      "nickname": "player_one",
      "team": "A",
      "playerOrder": 1
    },
    {
      "userId": "22222222-2222-4222-8222-222222222222",
      "nickname": "player_two",
      "team": "A",
      "playerOrder": 2
    },
    {
      "userId": "55555555-5555-4555-8555-555555555555",
      "nickname": "player_three",
      "team": "B",
      "playerOrder": 3
    },
    {
      "userId": "66666666-6666-4666-8666-666666666666",
      "nickname": "player_four",
      "team": "B",
      "playerOrder": 4
    }
  ],
  "teamAPosition": 8,
  "teamBPosition": 3,
  "currentTeam": "A",
  "currentMimePlayerId": "11111111-1111-4111-8111-111111111111",
  "timerEndsAt": null,
  "isSpecialTile": false,
  "isPaused": true,
  "pausedAt": "2026-07-26T18:00:30Z",
  "disconnectedUserId": "22222222-2222-4222-8222-222222222222",
  "remainingRoundSecondsOnPause": 30
}
